<?xml version="1.0" encoding="UTF-8"?>
<!--
/**
 * Copyright Â© 2013-2017 Magento, Inc. All rights reserved.
 * See COPYING.txt for license details.
 */
-->
<xs:schema xmlns:xs="http://www.w3.org/2001/XMLSchema">
    <xs:element name="config" type="configDeclaration"/>

    <xs:complexType name="configDeclaration">
        <xs:sequence>
            <xs:element ref="advanced_group" minOccurs="1" maxOccurs="1" />
        </xs:sequence>
    </xs:complexType>

    <xs:element name="advanced_group">
        <xs:complexType>
            <xs:sequence>
                <xs:choice minOccurs="0" maxOccurs="unbounded">
                    <xs:element ref="group" />
                </xs:choice>
            </xs:sequence>
        </xs:complexType>
        
		<xs:unique name="uniqueGroupId">
            <xs:annotation>
                <xs:documentation>
                    Attribute id is unique under all groups for each section
                </xs:documentation>
            </xs:annotation>
            <xs:selector xpath="group"/>
            <xs:field xpath="@id"/>
        </xs:unique>
    </xs:element>

    <xs:attributeGroup name="elementsAttributeGroup">
        <xs:attribute name="id" type="typeId" use="required" />
        <xs:attribute name="translate" type="xs:string" use="optional" />
        <xs:attribute name="type" type="xs:string" use="optional" />
        <xs:attribute name="sortOrder" type="xs:float" use="optional" />
    </xs:attributeGroup>

    <xs:element name="group">
        <xs:annotation>
            <xs:documentation>
                Group Resource. Recursive complex type
            </xs:documentation>
        </xs:annotation>

        <xs:complexType>
            <xs:sequence>
                <xs:choice minOccurs="0" maxOccurs="unbounded">
                    <xs:element name="label" type="xs:string" />
                    <xs:element name="fieldset_css" type="xs:string" />
                    <xs:element name="frontend_model" type="typeModel" />
                    <xs:element name="comment" type="xs:string" />
                    <xs:element ref="field" />
                </xs:choice>
            </xs:sequence>

            <xs:attributeGroup ref="elementsAttributeGroup"/>
        </xs:complexType>

        <xs:unique name="uniqueFieldId">
            <xs:annotation>
                <xs:documentation>
                    Attribute id is unique under all fields for each group
                </xs:documentation>
            </xs:annotation>
            <xs:selector xpath="field"/>
            <xs:field xpath="@id"/>
        </xs:unique>
    </xs:element>

    <xs:element name="field">
        <xs:annotation>
            <xs:documentation>
                Field Resource. Recursive complex type
            </xs:documentation>
        </xs:annotation>

        <xs:complexType>
            <xs:sequence>
                <xs:choice minOccurs="0" maxOccurs="unbounded">
                    <xs:element name="label" type="xs:string" />
                    <xs:element ref="comment" />
                    <xs:element name="required" type="xs:string" />
                    <xs:element name="frontend_class" type="xs:string" />
                    <xs:element name="frontend_model" type="typeModel" />
                    <xs:element name="backend_model" type="typeModel" />
                    <xs:element name="source_model" type="typeModel" />
                    <xs:element name="validate" type="xs:string" />
                </xs:choice>
            </xs:sequence>

            <xs:attributeGroup ref="elementsAttributeGroup"/>
        </xs:complexType>

        <xs:unique name="uniqueAttributeType">
            <xs:annotation>
                <xs:documentation>
                    Attribute type is unique under all node attributes per field
                </xs:documentation>
            </xs:annotation>
            <xs:selector xpath=".//attribute"/>
            <xs:field xpath="@type"/>
        </xs:unique>
    </xs:element>

    <xs:attributeGroup name="attributeAttributeGroup">
        <xs:attribute name="type" type="xs:string" use="required" />
        <xs:anyAttribute processContents="lax"/>
    </xs:attributeGroup>

    <xs:attributeGroup name="commentAttributeGroup">
        <xs:attribute name="model" type="xs:string" use="optional" />
        <xs:anyAttribute processContents="lax"/>
    </xs:attributeGroup>



    <xs:simpleType name="typeId">
        <xs:annotation>
            <xs:documentation>
                Item id attribute for elements section, group, field can has only [a-zA-Z0-9/_]. Minimal length 2 symbol. Case sensitive.
            </xs:documentation>
        </xs:annotation>

        <xs:restriction base="xs:string">
            <xs:pattern value="[a-zA-Z0-9_]{1,}" />
            <xs:minLength value="2" />
        </xs:restriction>
    </xs:simpleType>



    <xs:simpleType name="typeModel">
        <xs:annotation>
            <xs:documentation>
                Item model attribute can has only [a-zA-Z0-9_]. Minimal length 5 symbol. Case insensitive.
            </xs:documentation>
        </xs:annotation>
        <xs:restriction base="xs:string">
            <xs:pattern value="[A-Za-z0-9\\\\:]+" />
            <xs:minLength value="5" />
        </xs:restriction>
    </xs:simpleType>

    <xs:element name="comment">
        <xs:annotation>
            <xs:documentation>
                Comment type
            </xs:documentation>
        </xs:annotation>

        <xs:complexType mixed="true">
            <xs:sequence>
                <xs:any minOccurs="0" maxOccurs="1" processContents="lax" />
            </xs:sequence>
            <xs:attributeGroup ref="commentAttributeGroup"/>
        </xs:complexType>
    </xs:element>

</xs:schema>
